{
  "actual_hard_cap_rejections": 2,
  "all_needles_exercised": true,
  "bank_cap_bytes": 536870912,
  "bank_object_shared": true,
  "candidate_budget_count": 1048576,
  "comparison_budget_bytes": 8589934592,
  "compile_seconds": 1.1664,
  "data_class": "PUBLIC_SYNTHETIC_ONLY",
  "elapsed_seconds": 2.9443,
  "input_bytes": 302132385,
  "leaf_cap_bytes": 67108864,
  "maximum_needle_bytes": 50331648,
  "needle_count": 6481,
  "nohit_64mib_seconds": 0.2033,
  "pattern_bytes": 302125863,
  "peak_rss_bytes": 714375168,
  "prefix_bytes": 16,
  "raw_buffer_slots": 12,
  "raw_files_written": 0,
  "redactions": 6481,
  "rss_budget_bytes": 1610612736,
  "schema": "cwk.rt055.amendment14-capacity-qa.v1",
  "six_giant_clean_seconds": 0.0058,
  "status": "PASS",
  "stream_input_output_cap_bytes": 67108864
}
